user,assistant
what does this doc talk about,"<think>
Okay, the user's question is asking, ""what does this doc talk about."" I need to figure out what they're referring to. They provided a bunch of context data with multiple entries, but none specifically state that there's a ""doc"" being discussed.

Looking through the information, the documents listed seem related to computer vision and deep learning in agriculture. There are technical backgrounds covering aspects like plant disease detection using transfer learning, different camera-based systems, cloud infrastructure components, smart applications for farming, environmental sensors, IoT devices, data processing algorithms, AI implementations, explainable AI methods, system architectures, and edge computing.

Since the user didn't mention any specific document or context, I have to make an educated guess. Maybe they're referring to a particular entry in this table, but without more details, it's hard to pin down. It could be about a specific application like plant disease detection using transfer learning techniques on a cloud platform. Alternatively, it might be about the architecture of sensors and data processing systems used in smart agriculture.

I should consider that if the user is referring to a specific document, I need more context. Otherwise, they might just want an overview of these topics. Maybe I can suggest looking into transfer learning methods for plant disease detection or cloud-based solutions for agricultural monitoring.
</think>

The question does not specify which document or topic needs to be discussed. Based on the provided information, it could be about a specific application in computer vision and deep learning within agriculture, such as plant disease detection using transfer learning approaches or cloud infrastructure for real-time monitoring systems."
what is your thoughts on my research paper and computer network assignment,"<think>
The user is asking about their research paper and computer network assignment. They provided context with various documents, including topics like plant disease detection, cloud infrastructure, smart agriculture, etc. 

Given that they didn't specify which document or topic, I need to make an educated guess based on the context provided. The context includes multiple entries across different areas like plant biology, sensor technology, data processing, and system architectures.

The user might be referring to a specific application within one of these topics, but without more details, it's hard to pinpoint exactly what they're asking about. However, I can suggest looking into areas like transfer learning for plant disease detection using CNNs or cloud-based smart agriculture solutions.

I should keep the response concise and clear, summarizing possible interpretations based on the information provided.
</think>

The user might be referring to a specific application within the provided context, such as transfer learning techniques in plant disease detection using deep learning models (CNNs) or cloud-based smart agricultural systems. Without more details, it's challenging to pinpoint exactly, but I suggest exploring topics like plant disease detection with CNNs for transfer learning strategies or cloud infrastructure solutions for real-time monitoring in agriculture."
